{
  "schema_version": 1,
  "locale": "zh-CN",
  "scenario_id": "1_5_031sak_1_5_031_00_4",
  "source_raw_hash": "sha256:65592b1ef6033340c69326e77ecd9f3222edaf5c771a2a43ed3057f566491ef1",
  "entries": {
    "story-text:v1:1_5_031sak_1_5_031_00_4:1_5_031_00_4:cmd-000000:title:000": {
      "source_hash": "sha256:c9578f41f04512f8dd518c9243e386d3dec69c30c8930a99faa1eaef07ea0ceb",
      "text": "开始工作",
      "status": "draft"
    },
    "story-text:v1:1_5_031sak_1_5_031_00_4:1_5_031_00_4:cmd-000000:synopsis:000": {
      "source_hash": "sha256:b5d3e8fa043af75a87dd4faef01ce8885090903c7489ecb33e70005fc16c71c5",
      "text": "【剧情梗概】",
      "status": "draft"
    },
    "story-text:v1:1_5_031sak_1_5_031_00_4:1_5_031_00_4:cmd-000017:dialogue:000": {
      "source_hash": "sha256:5bfabb37de0969751c2bc9235df4ee550a7e9b5ba22b6e8d8fbf30f1413af3a8",
      "text": "制作人，快听我说！刚才工作人员\n夸我的大肠发圈好可爱呢♪",
      "status": "draft"
    }
  }
}
