{
  "schema_version": 1,
  "locale": "zh-CN",
  "scenario_id": "1_3_30010_01_b",
  "source_raw_hash": "sha256:33c3c9ba3f1692deb0f38c03a7dc7ac6657ae5140470697f0b0ba0f6fbe391e1",
  "entries": {
    "story-text:v1:1_3_30010_01:1_3_30010_01_b:cmd-000020:time_caption:000": {
      "source_hash": "sha256:6fb512a54279d51dca428e90d690e09db5bfeec4e1720dd5f175a852419d2b6e",
      "text": "数日后……",
      "status": "draft"
    },
    "story-text:v1:1_3_30010_01:1_3_30010_01_b:cmd-000027:time_caption:000": {
      "source_hash": "sha256:1b83027b478420ddbdd018c9e59f64ee9be44a33cf0f2dadc9c3e274fb9aec91",
      "text": "业务商谈现场·会议室",
      "status": "draft"
    },
    "story-text:v1:1_3_30010_01:1_3_30010_01_b:cmd-000037:dialogue:000": {
      "source_hash": "sha256:6672cd44b3f49162c6c26bce495a6e8de2ccd51fe22c052df83320ac8bdcf4cb",
      "text": "（老字号钟表品牌KIETOKI，\n给Legenders发来了工作邀约）",
      "status": "draft"
    },
    "story-text:v1:1_3_30010_01:1_3_30010_01_b:cmd-000039:dialogue:000": {
      "source_hash": "sha256:7aec4833a158e0b7c5a8537e7302f6d20d82db92ac79de973e3d2382fd6fb90a",
      "text": "（作为公关担当，担任手表模特、出演广告、\n歌曲商业合作……要做的事非常丰富！）",
      "status": "draft"
    },
    "story-text:v1:1_3_30010_01:1_3_30010_01_b:cmd-000048:dialogue:000": {
      "source_hash": "sha256:b10e010e6beb4753169d1c9af5cff384a99630a4cc035b31d24bafb644ae6447",
      "text": "……以上就是全部说明。\n各位有什么疑问吗？",
      "status": "draft"
    },
    "story-text:v1:1_3_30010_01:1_3_30010_01_b:cmd-000052:dialogue:000": {
      "source_hash": "sha256:f186e46cbdbf72efed0cca259a93371b4a69254fb6f00946126ade81f4600839",
      "text": "我在意的地方刚才●●●●プロデューサー\n都已经帮忙问过了，我没问题哦～",
      "status": "draft"
    },
    "story-text:v1:1_3_30010_01:1_3_30010_01_b:cmd-000061:dialogue:000": {
      "source_hash": "sha256:f5d96788f7dcf6cc6e3f95e44af93257ddd4f75c78f940c158fa39f32b6bb5fb",
      "text": "我也没有问题。能把这么重要的工作\n托付给我们这群新人，实在是非常荣幸。",
      "status": "draft"
    },
    "story-text:v1:1_3_30010_01:1_3_30010_01_b:cmd-000068:dialogue:000": {
      "source_hash": "sha256:0f1799b104f369abf20635ffd2374b9417b3b41542eb875039cca8c42525d982",
      "text": "确实如此。\n为了不辜负期望，我等定当竭力精进。",
      "status": "draft"
    },
    "story-text:v1:1_3_30010_01:1_3_30010_01_b:cmd-000072:dialogue:000": {
      "source_hash": "sha256:8ed989a926cd24b1f1c10fda994777efeaeab8f23da619256f7d514176e82392",
      "text": "哪里的话，各位能够接下这份工作我们也感到十分高兴！\n在活动当天到来前，还请多多关照。",
      "status": "draft"
    },
    "story-text:v1:1_3_30010_01:1_3_30010_01_b:cmd-000079:dialogue:000": {
      "source_hash": "sha256:3e8ba9664e3495189aeb26b864b95ef25e22916ec7f47f9d568d25d7aa7dd596",
      "text": "那么，今天的商谈就到此结束。\n下周初我们会再次联系……",
      "status": "draft"
    },
    "story-text:v1:1_3_30010_01:1_3_30010_01_b:cmd-000089:dialogue:000": {
      "source_hash": "sha256:e755c96eef0ff5e963d3fcbd69263e3fd94679e7a479ddf5c4141d956b779410",
      "text": "打扰一下。",
      "status": "draft"
    },
    "story-text:v1:1_3_30010_01:1_3_30010_01_b:cmd-000091:dialogue:000": {
      "source_hash": "sha256:376f636e08f0cc837e40c094e3b4fff729dec486bc29340f5849eb6083333bc4",
      "text": "木时会长！",
      "status": "draft"
    }
  }
}
