{
  "schema_version": 1,
  "locale": "zh-CN",
  "scenario_id": "1_2_013_01_e",
  "source_raw_hash": "sha256:4394933e8b7f558c8938261657bf0cf8ef489d21e0f8abf7c5e45aad54518636",
  "entries": {
    "story-text:v1:1_2_013kys_01_1_2_013_01:1_2_013_01_e:cmd-000022:dialogue:000": {
      "source_hash": "sha256:dc1054f9098160786cf4969f54dd310d03c016b466276489f93a0d304cdf26c9",
      "text": "谢谢你，监督！定下了很棒的礼物呢。\n来商量真是太对了。",
      "status": "draft"
    },
    "story-text:v1:1_2_013kys_01_1_2_013_01:1_2_013_01_e:cmd-000026:dialogue:000": {
      "source_hash": "sha256:c7f4fec4cd85db51eb3b65b448c5b491f90189e4f8ac6735c3859f10c958f8ba",
      "text": "是悠介想要的东西，而且感觉也能让他吓一跳。",
      "status": "draft"
    },
    "story-text:v1:1_2_013kys_01_1_2_013_01:1_2_013_01_e:cmd-000032:dialogue:000": {
      "source_hash": "sha256:93f2cb180cc5f8e02c1191c9c54e97235a7761b1fd536fbcbad220454426d689",
      "text": "话虽如此，根据他送的礼物，\n说不定我也会吓一跳呢。",
      "status": "draft"
    },
    "story-text:v1:1_2_013kys_01_1_2_013_01:1_2_013_01_e:cmd-000035:dialogue:000": {
      "source_hash": "sha256:4d7ee384e27639a753a7fbfd23850f95f6a8a47938b2b2a03bd8cf95032a0b47",
      "text": "比赛结果出来后请务必告诉我哦。",
      "status": "draft"
    },
    "story-text:v1:1_2_013kys_01_1_2_013_01:1_2_013_01_e:cmd-000040:dialogue:000": {
      "source_hash": "sha256:5d4b64985f6f391e49c4a7a135b79f69610f5c88ba5b8fd5e95bd32cf5d6f33e",
      "text": "当然啦。说不定，\n我和悠介会同时给你发联络哦。",
      "status": "draft"
    },
    "story-text:v1:1_2_013kys_01_1_2_013_01:1_2_013_01_e:cmd-000046:dialogue:000": {
      "source_hash": "sha256:594a641eef1c5f5b43578ae44989b5b1b1f2e013f69d54a59f828300797b0759",
      "text": "就像我找监督商量一样，我觉得悠介也会找你商量的。\n这就是所谓的双胞胎直觉啦。",
      "status": "draft"
    },
    "story-text:v1:1_2_013kys_01_1_2_013_01:1_2_013_01_e:cmd-000051:dialogue:000": {
      "source_hash": "sha256:929a13bbc818981d3b0f8cca5b1fa09f90101326f9acb03a76d090edb06f461b",
      "text": "不如说，难道他已经来商量过了？",
      "status": "draft"
    },
    "story-text:v1:1_2_013kys_01_1_2_013_01:1_2_013_01_e:cmd-000053:dialogue:000": {
      "source_hash": "sha256:c8014a384a22ba6d1d2fbd5d4e985370a29e15a6510d5b8839622160aba78d41",
      "text": "这个嘛……",
      "status": "draft"
    },
    "story-text:v1:1_2_013kys_01_1_2_013_01:1_2_013_01_e:cmd-000057:dialogue:000": {
      "source_hash": "sha256:08616ebfbe05958c29eed6d905031698845ebd2a10815fec6e5afab1f68a7c04",
      "text": "啊，先别告诉我答案！",
      "status": "draft"
    },
    "story-text:v1:1_2_013kys_01_1_2_013_01:1_2_013_01_e:cmd-000060:dialogue:000": {
      "source_hash": "sha256:912ec4214d86686db9c73741da5a8ad52c9bc794bd693105fe1de84e5580e3bd",
      "text": "因为我也想把这个留到当天当惊喜嘛。",
      "status": "draft"
    },
    "story-text:v1:1_2_013kys_01_1_2_013_01:1_2_013_01_e:cmd-000067:dialogue:000": {
      "source_hash": "sha256:9705593746a75160134cb3e68b2dff45e8a51a45c18c25961d27fd878c5fe882",
      "text": "那么，监督。今天谢谢你陪我出来。\n礼物的结果我绝对会联系你的！",
      "status": "draft"
    }
  }
}
