{
  "schema_version": 1,
  "locale": "zh-CN",
  "scenario_id": "1_1_011_03_e",
  "source_raw_hash": "sha256:4246d48205b4aa8745c5feb48fb335b7fc14c430a56944412377b374ef336f64",
  "entries": {
    "story-text:v1:1_1_011mof_03_1_1_011_03:1_1_011_03_e:cmd-000012:dialogue:000": {
      "source_hash": "sha256:9c3305ecc8390b37964f7cf6afd926cb0eeab4ec60f432729a0d3e44302b9477",
      "text": "那么开门见山……花音君，对偶像有\n兴趣吗？",
      "status": "draft"
    },
    "story-text:v1:1_1_011mof_03_1_1_011_03:1_1_011_03_e:cmd-000015:dialogue:000": {
      "source_hash": "sha256:a19b987e2ced2c43766d1a7cccf7ecfa3fcd2d61290395ba02ef97c64b9efd02",
      "text": "偶像，是那个偶像吗？",
      "status": "draft"
    },
    "story-text:v1:1_1_011mof_03_1_1_011_03:1_1_011_03_e:cmd-000019:dialogue:000": {
      "source_hash": "sha256:8b8178b81f294849642ab235b79ca5a4e094820733bf6d5b5a0b7afc0183a8cb",
      "text": "是的。就是边唱边跳的那个偶像。",
      "status": "draft"
    },
    "story-text:v1:1_1_011mof_03_1_1_011_03:1_1_011_03_e:cmd-000024:dialogue:000": {
      "source_hash": "sha256:e59ca365e3280595d4bff8b48b348b6e8947958798ea80bad1f42786316c606c",
      "text": "花音穿衣服、摆姿势虽然很拿手，\n但可没办法动那么多哦？",
      "status": "draft"
    },
    "story-text:v1:1_1_011mof_03_1_1_011_03:1_1_011_03_e:cmd-000027:dialogue:000": {
      "source_hash": "sha256:91b1db2145eb3aea8634f45a47dc728bda19f2b5e9a920355c498e676ee7f7b4",
      "text": "为什么会觉得花音能当偶像呢？",
      "status": "draft"
    },
    "story-text:v1:1_1_011mof_03_1_1_011_03:1_1_011_03_e:cmd-000029:dialogue:000": {
      "source_hash": "sha256:8e58bf7214fb7f922ec14a6962755e44af713973b8d2bd79bc5de0f40d89589b",
      "text": "之前花音君出演的特别节目，\n我在现场旁听过。",
      "status": "draft"
    },
    "story-text:v1:1_1_011mof_03_1_1_011_03:1_1_011_03_e:cmd-000046:dialogue:000": {
      "source_hash": "sha256:4103bb1ce1fea26e6d7491e22ae9e5472911e6b38467eaca03a743a5958133f7",
      "text": "深知什么是“可爱”，并能完美表达出来的\n花音君，真的非常耀眼！",
      "status": "draft"
    },
    "story-text:v1:1_1_011mof_03_1_1_011_03:1_1_011_03_e:cmd-000050:dialogue:000": {
      "source_hash": "sha256:239b778ef2d6e9b246e2eb3bdb62e98b4b1583bbe4ed246f1d24fdb9181a7114",
      "text": "我觉得花音君在舞台上也一定能\n抓住很多人的心！",
      "status": "draft"
    },
    "story-text:v1:1_1_011mof_03_1_1_011_03:1_1_011_03_e:cmd-000064:dialogue:000": {
      "source_hash": "sha256:116f2c4e1e03e4bcb497b765da82e66d159a9a8cf4c517f6631753e3c1349adf",
      "text": "哇，是这样啊……\n谢谢您♪",
      "status": "draft"
    }
  }
}
