{
  "schema_version": 1,
  "locale": "zh-CN",
  "scenario_id": "1_2_031_01_b",
  "source_raw_hash": "sha256:e1781c4ea5b05404605e672473b1c05701a19f977429bdac83c0a1c420c2c40a",
  "entries": {
    "story-text:v1:1_2_031sak_01_1_2_031_01:1_2_031_01_b:cmd-000013:dialogue:000": {
      "source_hash": "sha256:8a42bc3f29cafe22ca90c2e136973e0631f84d50aacb2ef8864e467c3681c2fb",
      "text": "就是要和女孩子们聊天对吧。\n那肯定是由我去聊对吧？",
      "status": "draft"
    },
    "story-text:v1:1_2_031sak_01_1_2_031_01:1_2_031_01_b:cmd-000018:dialogue:000": {
      "source_hash": "sha256:f8b13b1f06bdb5f55f1cae24f1f94a964d479e2e13bb7a1821d5d02aa7f3363d",
      "text": "是的，我和品牌方的人也会列席，不过……\n咲先生似乎有什么顾虑呢。",
      "status": "draft"
    },
    "story-text:v1:1_2_031sak_01_1_2_031_01:1_2_031_01_b:cmd-000025:dialogue:000": {
      "source_hash": "sha256:c7f870f48b6dd76780b0b9f8db7fedf4799cc490ef7bc7a93c825f98d01e4e27",
      "text": "嗯……我跟女孩子聊天的话，\n会觉得很紧张呢。",
      "status": "draft"
    },
    "story-text:v1:1_2_031sak_01_1_2_031_01:1_2_031_01_b:cmd-000030:dialogue:000": {
      "source_hash": "sha256:3c23bcf5bdac179a1b8ebfa11249d4cb726a943e2a0ceefda1d600f5976a36ab",
      "text": "可能会搞砸的……\n我真的能好好完成采访吗。",
      "status": "draft"
    },
    "story-text:v1:1_2_031sak_01_1_2_031_01:1_2_031_01_b:cmd-000034:dialogue:000": {
      "source_hash": "sha256:4916b958d964900ad933ecee72915b397e9e2b098274e123544cd7fb674f44d1",
      "text": "没事的。我也会从旁协助。\n一定会是一段愉快的时光的。",
      "status": "draft"
    },
    "story-text:v1:1_2_031sak_01_1_2_031_01:1_2_031_01_b:cmd-000037:dialogue:000": {
      "source_hash": "sha256:a1918a4a9c0120d8e6a29a277fb6907fc4a1e3053cafc5cdab30c4c372b517df",
      "text": "而且，这次工作能够实现，\n也是多亏了那些“女孩子们”哦。",
      "status": "draft"
    },
    "story-text:v1:1_2_031sak_01_1_2_031_01:1_2_031_01_b:cmd-000041:dialogue:000": {
      "source_hash": "sha256:8630eef8b6e90002a7997333b434e0ea05e9d6be49b0c965e015c5cc1e59c03e",
      "text": "女孩子们的……？",
      "status": "draft"
    },
    "story-text:v1:1_2_031sak_01_1_2_031_01:1_2_031_01_b:cmd-000043:dialogue:000": {
      "source_hash": "sha256:6cb97fe0ab48134b9a6969acc79c4352c7a4563caf90ca2504397437e4e2e98b",
      "text": "是的。据说崇拜咲先生的女孩子们的心声，\n大量传达到了服装品牌那里。",
      "status": "draft"
    },
    "story-text:v1:1_2_031sak_01_1_2_031_01:1_2_031_01_b:cmd-000046:dialogue:000": {
      "source_hash": "sha256:2cbc6839dbecf72b44292b0683f0c788efad9362a32cf2805b4cdf07a22c559f",
      "text": "为了回应她们的支持，\n这次的工作，我们一起努力吧！",
      "status": "draft"
    },
    "story-text:v1:1_2_031sak_01_1_2_031_01:1_2_031_01_b:cmd-000052:dialogue:000": {
      "source_hash": "sha256:7cf78f54eb7ec8d9bb2638b08481bf451133e2b5d8e1b9abc95143a9e2f87c5c",
      "text": "……嗯，我知道了。我干！\n为了大家的“可爱”，我要全力以赴啦！",
      "status": "draft"
    }
  }
}
