{
  "schema_version": 1,
  "locale": "zh-CN",
  "scenario_id": "1_1_009_02_j",
  "source_raw_hash": "sha256:9499408360e90444446ed2c2c80f162c2cb655e1f049636a4875838b0489639c",
  "entries": {
    "story-text:v1:1_1_009shi_02_1_1_009_02:1_1_009_02_j:cmd-000020:dialogue:000": {
      "source_hash": "sha256:9eb3de0cd113ad0e3f5a5e0ba53adcce223e7e4e3540e10d753c0663485be28c",
      "text": "回见啦，●●●●プロデューサー。\n我很期待试镜哦！",
      "status": "draft"
    },
    "story-text:v1:1_1_009shi_02_1_1_009_02:1_1_009_02_j:cmd-000024:dialogue:000": {
      "source_hash": "sha256:6718218a87f540e5db657401ab1895bc579d719e37539adc4c4f49c5f3fe9d5a",
      "text": "好的！今天非常感谢二位。",
      "status": "draft"
    },
    "story-text:v1:1_1_009shi_02_1_1_009_02:1_1_009_02_j:cmd-000048:dialogue:000": {
      "source_hash": "sha256:d863c81114c52f9c2b15989a40acb8c4a0784adcfe53b3e336d370c762b1512b",
      "text": "我们当偶像啊……嗯？",
      "status": "draft"
    },
    "story-text:v1:1_1_009shi_02_1_1_009_02:1_1_009_02_j:cmd-000055:dialogue:000": {
      "source_hash": "sha256:c894f6bc2d842e605b28823ccf99d7a65040fe7d4ddece50dd6777e1af5a50a6",
      "text": "这么说来，我们也要穿\n那种闪闪发光的衣服了吗？",
      "status": "draft"
    },
    "story-text:v1:1_1_009shi_02_1_1_009_02:1_1_009_02_j:cmd-000061:dialogue:000": {
      "source_hash": "sha256:4b8366aeb6b263cb5420b614d5efbb540a1ac7de6c2a7bd5863cd49a3651ca2a",
      "text": "衣服的事我不知道，反正不管怎样，\n也得等试镜合格了再说。",
      "status": "draft"
    },
    "story-text:v1:1_1_009shi_02_1_1_009_02:1_1_009_02_j:cmd-000065:dialogue:000": {
      "source_hash": "sha256:4ff43385b6025fc70c1981a457a1c8eda3d6ba05d8bc7d06177373976e2b48b9",
      "text": "我们在偶像这方面只是门外汉。\n要是掉以轻心可是会吃大亏的。",
      "status": "draft"
    },
    "story-text:v1:1_1_009shi_02_1_1_009_02:1_1_009_02_j:cmd-000069:dialogue:000": {
      "source_hash": "sha256:ab0dcb0dcce05c4d4c6894f7f574a342013d830c03bdd42f5379c9fe45b5ef25",
      "text": "门外汉确实是门外汉，\n但心头的热血可不会输给任何人！",
      "status": "draft"
    },
    "story-text:v1:1_1_009shi_02_1_1_009_02:1_1_009_02_j:cmd-000075:dialogue:000": {
      "source_hash": "sha256:15241fabffc688672d89ec48b229b05e037d26166140b84440f985b48bd3eee1",
      "text": "我们的话一定能合格！\n喵子也这么觉得吧？",
      "status": "draft"
    },
    "story-text:v1:1_1_009shi_02_1_1_009_02:1_1_009_02_j:cmd-000078:dialogue:000": {
      "source_hash": "sha256:ea2adc4477387fa8351a5d472c0e3e247016824ff71edd7bf5a0fc6eaf87b6e4",
      "text": "喵——！",
      "status": "draft"
    },
    "story-text:v1:1_1_009shi_02_1_1_009_02:1_1_009_02_j:cmd-000084:dialogue:000": {
      "source_hash": "sha256:5d723a6fbc9576c40f5727c921b01aa50a0d46ec50446e2f6999a22e8377226a",
      "text": "说的也是……慧可断臂，\n既然要做，就一定要通过给你看！",
      "status": "draft"
    },
    "story-text:v1:1_1_009shi_02_1_1_009_02:1_1_009_02_j:cmd-000091:dialogue:000": {
      "source_hash": "sha256:6f463ed285e89c086c53e069626fe8fd1e774e1ac2151e5c2da881122a0a43a8",
      "text": "噢！一个都不能少。\n全员一起合格啊！",
      "status": "draft"
    }
  }
}
