{
  "schema_version": 1,
  "locale": "zh-CN",
  "scenario_id": "1_5_029ass_1_5_029_00_2",
  "source_raw_hash": "sha256:65592b1ef6033340c69326e77ecd9f3222edaf5c771a2a43ed3057f566491ef1",
  "entries": {
    "story-text:v1:1_5_029ass_1_5_029_00_2:1_5_029_00_2:cmd-000000:title:000": {
      "source_hash": "sha256:c9578f41f04512f8dd518c9243e386d3dec69c30c8930a99faa1eaef07ea0ceb",
      "text": "开始工作",
      "status": "draft"
    },
    "story-text:v1:1_5_029ass_1_5_029_00_2:1_5_029_00_2:cmd-000000:synopsis:000": {
      "source_hash": "sha256:b5d3e8fa043af75a87dd4faef01ce8885090903c7489ecb33e70005fc16c71c5",
      "text": "【剧情梗概】",
      "status": "draft"
    },
    "story-text:v1:1_5_029ass_1_5_029_00_2:1_5_029_00_2:cmd-000016:dialogue:000": {
      "source_hash": "sha256:2c43e44ab5d5cbf5aa9d6bb9ce0b9ea1334a1e74c6abde1e74cd20b53b9a95ca",
      "text": "库库库……在安息日与同胞团共同修炼，\n本座的力量正在不断高涨！",
      "status": "draft"
    }
  }
}
