{
  "schema_version": 1,
  "locale": "zh-CN",
  "scenario_id": "1_5_024shk_1_5_024_00_1",
  "source_raw_hash": "sha256:65592b1ef6033340c69326e77ecd9f3222edaf5c771a2a43ed3057f566491ef1",
  "entries": {
    "story-text:v1:1_5_024shk_1_5_024_00_1:1_5_024_00_1:cmd-000000:title:000": {
      "source_hash": "sha256:c9578f41f04512f8dd518c9243e386d3dec69c30c8930a99faa1eaef07ea0ceb",
      "text": "开始工作",
      "status": "draft"
    },
    "story-text:v1:1_5_024shk_1_5_024_00_1:1_5_024_00_1:cmd-000000:synopsis:000": {
      "source_hash": "sha256:b5d3e8fa043af75a87dd4faef01ce8885090903c7489ecb33e70005fc16c71c5",
      "text": "【剧情梗概】",
      "status": "draft"
    },
    "story-text:v1:1_5_024shk_1_5_024_00_1:1_5_024_00_1:cmd-000020:dialogue:000": {
      "source_hash": "sha256:60315c37be5cf30fcb59c2ffa952f09abf25f9cc5858469be2af5d482617a21b",
      "text": "我当偶像会Mega Mega加油的，\n下次也拜托给我特别的工作啦☆",
      "status": "draft"
    }
  }
}
